{
  "schema": "mva-track2-lineage-counts/v1",
  "privacy_class": "synthetic",
  "purpose": "Aligned synthetic lineage counts for save-path tests.",
  "study_id": "syn-save-path-lineage",
  "synthetic_only": true,
  "lock_state": "locked",
  "blinded": true,
  "forbidden_keys_absent": [
    "generator_truth",
    "intended_flags",
    "latent_error",
    "realized_truth",
    "scenario_name",
    "unblinded_label"
  ],
  "claim_boundary": "Timestamped first-attempt competing-risk software contract only; pre-division death is labeled separately from other non-completion; this is not biological validation, mixed-effects clinical inference, or efficacy evidence.",
  "runs": [
    {
      "arm": "treatment",
      "edit_event_id": "syn-event-1",
      "clone_id": "syn-clone-1-1",
      "run_id": "syn-run-1",
      "batch_id": "syn-batch-a",
      "functional_execution_id": "syn-functional-1-1-member-a",
      "exposure_support_record_id": "syn-measurement-3",
      "exposure_profile_id": "profile-f379b5d7fd6861d0a57c0534122266899b4f1b822ddedf3517e5de83c49c9382",
      "exposure_probe_id": "syn-probe-a",
      "exposure_started_at": "2026-08-29T01:00:00Z",
      "endpoint_recorded_at": "2026-08-30T02:00:00Z",
      "opportunities": 38,
      "detected_divisions": 36,
      "event_positive_divisions": 4,
      "event_negative_divisions": 32,
      "event_positive_daughters_followed": 4,
      "event_positive_daughters_reproduced": 4,
      "event_positive_daughters_died": 0,
      "event_negative_daughters_followed": 8,
      "event_negative_daughters_reproduced": 8,
      "event_negative_daughters_died": 0,
      "pre_division_death": 1,
      "no_division": 1,
      "dropout_censored": 0,
      "allocation_block_id": "syn-allocation-block-1",
      "functional_assay_plate_id": "syn-functional-plate-a",
      "plate_row": 1,
      "plate_column": 3,
      "dosing_order": 1,
      "acquisition_order": 3,
      "latest_enrolled_at": "2026-08-29T00:00:00Z"
    },
    {
      "arm": "vehicle",
      "edit_event_id": "syn-event-1",
      "clone_id": "syn-clone-1-1",
      "run_id": "syn-run-1",
      "batch_id": "syn-batch-a",
      "functional_execution_id": "syn-functional-1-1-member-b",
      "exposure_support_record_id": "syn-vehicle-control-record-a",
      "exposure_profile_id": "profile-vehicle-control",
      "exposure_probe_id": "syn-vehicle-a",
      "exposure_started_at": "2026-08-29T01:00:00Z",
      "endpoint_recorded_at": "2026-08-30T02:00:00Z",
      "opportunities": 38,
      "detected_divisions": 36,
      "event_positive_divisions": 12,
      "event_negative_divisions": 24,
      "event_positive_daughters_followed": 8,
      "event_positive_daughters_reproduced": 4,
      "event_positive_daughters_died": 0,
      "event_negative_daughters_followed": 8,
      "event_negative_daughters_reproduced": 8,
      "event_negative_daughters_died": 0,
      "pre_division_death": 1,
      "no_division": 1,
      "dropout_censored": 0,
      "allocation_block_id": "syn-allocation-block-1",
      "functional_assay_plate_id": "syn-functional-plate-a",
      "plate_row": 1,
      "plate_column": 5,
      "dosing_order": 2,
      "acquisition_order": 4,
      "latest_enrolled_at": "2026-08-29T00:00:00Z"
    },
    {
      "arm": "vehicle",
      "edit_event_id": "syn-event-1",
      "clone_id": "syn-clone-1-2",
      "run_id": "syn-run-1",
      "batch_id": "syn-batch-a",
      "functional_execution_id": "syn-functional-1-2-member-a",
      "exposure_support_record_id": "syn-vehicle-control-record-a",
      "exposure_profile_id": "profile-vehicle-control",
      "exposure_probe_id": "syn-vehicle-a",
      "exposure_started_at": "2026-08-29T01:00:00Z",
      "endpoint_recorded_at": "2026-08-30T02:00:00Z",
      "opportunities": 38,
      "detected_divisions": 36,
      "event_positive_divisions": 12,
      "event_negative_divisions": 24,
      "event_positive_daughters_followed": 8,
      "event_positive_daughters_reproduced": 4,
      "event_positive_daughters_died": 0,
      "event_negative_daughters_followed": 8,
      "event_negative_daughters_reproduced": 8,
      "event_negative_daughters_died": 0,
      "pre_division_death": 1,
      "no_division": 1,
      "dropout_censored": 0,
      "allocation_block_id": "syn-allocation-block-2",
      "functional_assay_plate_id": "syn-functional-plate-a",
      "plate_row": 2,
      "plate_column": 5,
      "dosing_order": 4,
      "acquisition_order": 2,
      "latest_enrolled_at": "2026-08-29T00:00:00Z"
    },
    {
      "arm": "treatment",
      "edit_event_id": "syn-event-1",
      "clone_id": "syn-clone-1-2",
      "run_id": "syn-run-1",
      "batch_id": "syn-batch-a",
      "functional_execution_id": "syn-functional-1-2-member-b",
      "exposure_support_record_id": "syn-measurement-3",
      "exposure_profile_id": "profile-f379b5d7fd6861d0a57c0534122266899b4f1b822ddedf3517e5de83c49c9382",
      "exposure_probe_id": "syn-probe-a",
      "exposure_started_at": "2026-08-29T01:00:00Z",
      "endpoint_recorded_at": "2026-08-30T02:00:00Z",
      "opportunities": 38,
      "detected_divisions": 36,
      "event_positive_divisions": 4,
      "event_negative_divisions": 32,
      "event_positive_daughters_followed": 4,
      "event_positive_daughters_reproduced": 4,
      "event_positive_daughters_died": 0,
      "event_negative_daughters_followed": 8,
      "event_negative_daughters_reproduced": 8,
      "event_negative_daughters_died": 0,
      "pre_division_death": 1,
      "no_division": 1,
      "dropout_censored": 0,
      "allocation_block_id": "syn-allocation-block-2",
      "functional_assay_plate_id": "syn-functional-plate-a",
      "plate_row": 2,
      "plate_column": 3,
      "dosing_order": 3,
      "acquisition_order": 1,
      "latest_enrolled_at": "2026-08-29T00:00:00Z"
    },
    {
      "arm": "vehicle",
      "edit_event_id": "syn-event-1",
      "clone_id": "syn-clone-1-3",
      "run_id": "syn-run-1",
      "batch_id": "syn-batch-a",
      "functional_execution_id": "syn-functional-1-3-member-a",
      "exposure_support_record_id": "syn-vehicle-control-record-a",
      "exposure_profile_id": "profile-vehicle-control",
      "exposure_probe_id": "syn-vehicle-a",
      "exposure_started_at": "2026-08-29T01:00:00Z",
      "endpoint_recorded_at": "2026-08-30T02:00:00Z",
      "opportunities": 38,
      "detected_divisions": 36,
      "event_positive_divisions": 12,
      "event_negative_divisions": 24,
      "event_positive_daughters_followed": 8,
      "event_positive_daughters_reproduced": 4,
      "event_positive_daughters_died": 0,
      "event_negative_daughters_followed": 8,
      "event_negative_daughters_reproduced": 8,
      "event_negative_daughters_died": 0,
      "pre_division_death": 1,
      "no_division": 1,
      "dropout_censored": 0,
      "allocation_block_id": "syn-allocation-block-3",
      "functional_assay_plate_id": "syn-functional-plate-a",
      "plate_row": 3,
      "plate_column": 3,
      "dosing_order": 5,
      "acquisition_order": 9,
      "latest_enrolled_at": "2026-08-29T00:00:00Z"
    },
    {
      "arm": "treatment",
      "edit_event_id": "syn-event-1",
      "clone_id": "syn-clone-1-3",
      "run_id": "syn-run-1",
      "batch_id": "syn-batch-a",
      "functional_execution_id": "syn-functional-1-3-member-b",
      "exposure_support_record_id": "syn-measurement-3",
      "exposure_profile_id": "profile-f379b5d7fd6861d0a57c0534122266899b4f1b822ddedf3517e5de83c49c9382",
      "exposure_probe_id": "syn-probe-a",
      "exposure_started_at": "2026-08-29T01:00:00Z",
      "endpoint_recorded_at": "2026-08-30T02:00:00Z",
      "opportunities": 38,
      "detected_divisions": 36,
      "event_positive_divisions": 4,
      "event_negative_divisions": 32,
      "event_positive_daughters_followed": 4,
      "event_positive_daughters_reproduced": 4,
      "event_positive_daughters_died": 0,
      "event_negative_daughters_followed": 8,
      "event_negative_daughters_reproduced": 8,
      "event_negative_daughters_died": 0,
      "pre_division_death": 1,
      "no_division": 1,
      "dropout_censored": 0,
      "allocation_block_id": "syn-allocation-block-3",
      "functional_assay_plate_id": "syn-functional-plate-a",
      "plate_row": 3,
      "plate_column": 5,
      "dosing_order": 6,
      "acquisition_order": 10,
      "latest_enrolled_at": "2026-08-29T00:00:00Z"
    },
    {
      "arm": "treatment",
      "edit_event_id": "syn-event-1",
      "clone_id": "syn-clone-1-4",
      "run_id": "syn-run-1",
      "batch_id": "syn-batch-a",
      "functional_execution_id": "syn-functional-1-4-member-a",
      "exposure_support_record_id": "syn-measurement-3",
      "exposure_profile_id": "profile-f379b5d7fd6861d0a57c0534122266899b4f1b822ddedf3517e5de83c49c9382",
      "exposure_probe_id": "syn-probe-a",
      "exposure_started_at": "2026-08-29T01:00:00Z",
      "endpoint_recorded_at": "2026-08-30T02:00:00Z",
      "opportunities": 38,
      "detected_divisions": 36,
      "event_positive_divisions": 4,
      "event_negative_divisions": 32,
      "event_positive_daughters_followed": 4,
      "event_positive_daughters_reproduced": 4,
      "event_positive_daughters_died": 0,
      "event_negative_daughters_followed": 8,
      "event_negative_daughters_reproduced": 8,
      "event_negative_daughters_died": 0,
      "pre_division_death": 1,
      "no_division": 1,
      "dropout_censored": 0,
      "allocation_block_id": "syn-allocation-block-4",
      "functional_assay_plate_id": "syn-functional-plate-a",
      "plate_row": 4,
      "plate_column": 5,
      "dosing_order": 8,
      "acquisition_order": 8,
      "latest_enrolled_at": "2026-08-29T00:00:00Z"
    },
    {
      "arm": "vehicle",
      "edit_event_id": "syn-event-1",
      "clone_id": "syn-clone-1-4",
      "run_id": "syn-run-1",
      "batch_id": "syn-batch-a",
      "functional_execution_id": "syn-functional-1-4-member-b",